title,date,venue,price,organizer,description,image_url,concert_link,location,event_type
Children’s Theatre-in-the-WoodsPinkaliciousThe MusicalVital Theatre Company,,Wolf Trap National Park,,Wolf Trap Foundation,,,https://www.wolftrap.org/calendar/performance/25ctitw/0627show25.aspx#datetime=06272025T103000,DC,classical
UNTRAPPEDWolf Trap Opera Studio Artists in Concert,,Wolf Trap National Park,,Wolf Trap Foundation,,,https://www.wolftrap.org/calendar/performance/25opera/studio-artists.aspx#datetime=07092025T190000,DC,classical
"Star Wars: The Empire Strikes Backin ConcertNational Symphony OrchestraSteven Reineke, conductor",,Wolf Trap National Park,,Wolf Trap Foundation,,,https://www.wolftrap.org/calendar/performance/25filene/0717show25.aspx#datetime=07172025T200000,DC,classical
"Jean-Yves Thibaudet plays GershwinNational Symphony OrchestraKatharina Wincor, conductor",,Wolf Trap National Park,,Wolf Trap Foundation,,,https://www.wolftrap.org/calendar/performance/25filene/0718show25.aspx#datetime=07182025T200000,DC,classical
"OrffCarmina BuranaNational Symphony OrchestraTianyi Lu, conductor",,Wolf Trap National Park,,Wolf Trap Foundation,,,https://www.wolftrap.org/calendar/performance/25filene/0725show25.aspx#datetime=07252025T200000,DC,classical
